live_id,species,user_id,user_name,gender,time,content,label
porteaportefashion,Apparel & Footwear,unknown,lilmiss marmite Claire ,unknown,2025/4/14 1:06,how much are these shoes please and are they true to size,1
porteaportefashion,Apparel & Footwear,unknown,Breeze18_,unknown,2025/4/14 1:06,Have u alrdy done the shirts?,1
porteaportefashion,Apparel & Footwear,unknown,Hanouna,unknown,2025/4/14 1:06,how much,1
porteaportefashion,Apparel & Footwear,unknown,Livelovelaugh,unknown,2025/4/14 1:06,All I need is the red to complete the collection,0
porteaportefashion,Apparel & Footwear,unknown,sehrishbutt93,unknown,2025/4/14 1:06,Thanks for letting us know Abdul :),0
porteaportefashion,Apparel & Footwear,unknown,Vicky,unknown,2025/4/14 1:06,U getting anymore oval tan belts in please?,1
porteaportefashion,Apparel & Footwear,unknown,sarahjane18,unknown,2025/4/14 1:06,Leopard wedges,1
porteaportefashion,Apparel & Footwear,unknown,Missy,unknown,2025/4/14 1:06,"LADIES PLEASE RESPECT ABDUL AND MODS, ABDUL HAS ASKED NO REQUESTS",0
porteaportefashion,Apparel & Footwear,unknown,lilmiss marmite Claire ,unknown,2025/4/14 1:06,how much please,1
porteaportefashion,Apparel & Footwear,unknown,Breeze18_,unknown,2025/4/14 1:06,Have I missed oversized shirts,1
porteaportefashion,Apparel & Footwear,unknown,AmyJ,unknown,2025/4/14 1:06,So beautiful,0
porteaportefashion,Apparel & Footwear,unknown,LianneWP,unknown,2025/4/14 1:06,if you like the vibes in here like we do hit the orange heart  then subscribe in the left hand,0
porteaportefashion,Apparel & Footwear,unknown,     ,unknown,2025/4/14 1:07,oooo with strap be lovely,0
porteaportefashion,Apparel & Footwear,unknown,sarahjane18,unknown,2025/4/14 1:07,Thanks,0
porteaportefashion,Apparel & Footwear,unknown,abby4900,unknown,2025/4/14 1:07,thx u,0
porteaportefashion,Apparel & Footwear,unknown,Crochet_Critter,unknown,2025/4/14 1:07,can we have size 26 jeggings please,1
porteaportefashion,Apparel & Footwear,unknown,Ally Galbraith ,unknown,2025/4/14 1:07,"NO REQUESTS PLEASE LADIES, JUST ENJOY THE BEAUTIFUL ITEMS ABDUL HAS FOR US",0
porteaportefashion,Apparel & Footwear,unknown,,unknown,2025/4/14 1:07,Hi Abdul,0
porteaportefashion,Apparel & Footwear,unknown,Kate,unknown,2025/4/14 1:07,Do you have any flat slidders /sandles please,1
porteaportefashion,Apparel & Footwear,unknown,Kari,unknown,2025/4/14 1:07,They are so comfortable,1
porteaportefashion,Apparel & Footwear,unknown,Jess Macgurk,unknown,2025/4/14 1:08,but cant order 2 the same size,0
porteaportefashion,Apparel & Footwear,unknown,LianneWP,unknown,2025/4/14 1:08,if you like the vibes in here like we do hit the orange heart  then subscribe in the left hand,0
porteaportefashion,Apparel & Footwear,unknown,Sharna Morgan,unknown,2025/4/14 1:09,The amount off amazing stuff you do is incredible beautiful beautiful beautiful,0
porteaportefashion,Apparel & Footwear,unknown,francesyoung346,unknown,2025/4/14 1:09,Can you show it close to the camera plz,1
porteaportefashion,Apparel & Footwear,unknown,April Claire Lamb,unknown,2025/4/14 1:09,Received my wedges they are fantastic thank you,0
porteaportefashion,Apparel & Footwear,unknown,AmyJ,unknown,2025/4/14 1:09,Lovely,0
porteaportefashion,Apparel & Footwear,unknown,Missy,unknown,2025/4/14 1:09,"LADIES PLEASE RESPECT ABDUL AND MODS, ABDUL HAS ASKED NO REQUESTS",0
porteaportefashion,Apparel & Footwear,unknown,Kate,unknown,2025/4/14 1:09,Do you have any flat slidders ?,1
porteaportefashion,Apparel & Footwear,unknown,Faiza,unknown,2025/4/14 1:09,Can I see the black please ???,1
porteaportefashion,Apparel & Footwear,unknown,Nicola ,unknown,2025/4/14 1:09,Can I see the ones Jen is wearing again,1
porteaportefashion,Apparel & Footwear,unknown,cara,unknown,2025/4/14 1:09,Beige sold out it saying for me,0
porteaportefashion,Apparel & Footwear,unknown,Fee7219,unknown,2025/4/14 1:10,Had mine delivered today they are gorgeous,0
porteaportefashion,Apparel & Footwear,unknown,Chloe ,unknown,2025/4/14 1:10,"Already have stone, pre ordered denim and red",0
porteaportefashion,Apparel & Footwear,unknown,cara,unknown,2025/4/14 1:10,Beige gone,0
porteaportefashion,Apparel & Footwear,unknown,Minnieme,unknown,2025/4/14 1:10,got the Denim,0
porteaportefashion,Apparel & Footwear,unknown,Ronnie & Wils,unknown,2025/4/14 1:10,Just ordered denim,0
porteaportefashion,Apparel & Footwear,unknown,BridieeˇŻ ,unknown,2025/4/14 1:10,Just joined as these good for wide feet?,1
porteaportefashion,Apparel & Footwear,unknown,michelle,unknown,2025/4/14 1:10,got beige and denim,0
porteaportefashion,Apparel & Footwear,unknown,gina,unknown,2025/4/14 1:10,got black and blue,0
porteaportefashion,Apparel & Footwear,unknown,francesyoung346,unknown,2025/4/14 1:10,Says buy now,0
porteaportefashion,Apparel & Footwear,unknown,Nicola ,unknown,2025/4/14 1:10,No size 8,0
porteaportefashion,Apparel & Footwear,unknown,Kim,unknown,2025/4/14 1:10,HOLD ORDERING PLEASE,0
porteaportefashion,Apparel & Footwear,unknown,  ..,unknown,2025/4/14 1:11,All colours are showing some sizes sold out,0
porteaportefashion,Apparel & Footwear,unknown,Queen of Hearts,unknown,2025/4/14 1:11,I ordered a few mins ago,0
porteaportefashion,Apparel & Footwear,unknown,Kim,unknown,2025/4/14 1:11,HOLD ON ORDERING,0
porteaportefashion,Apparel & Footwear,unknown,Aimzb,unknown,2025/4/14 1:11,can I ireer denim now,1
porteaportefashion,Apparel & Footwear,unknown,liz_alexander,unknown,2025/4/14 1:11,Got 2 pairs at last ty,0
porteaportefashion,Apparel & Footwear,unknown,Livelovelaugh,unknown,2025/4/14 1:11,Yay got my red,0
porteaportefashion,Apparel & Footwear,unknown,Sarah,unknown,2025/4/14 1:11,can we see the colours again,1
porteaportefashion,Apparel & Footwear,unknown,Aimzb,unknown,2025/4/14 1:11,can I order denim or not,1
porteaportefashion,Apparel & Footwear,unknown,staceydolltallulah1,unknown,2025/4/14 1:11,Black sold out,0
porteaportefashion,Apparel & Footwear,unknown,Caroline,unknown,2025/4/14 1:11,Does ur own size fit u in this Jen?,1
porteaportefashion,Apparel & Footwear,unknown,  ..,unknown,2025/4/14 1:11,I ordered black,0
porteaportefashion,Apparel & Footwear,unknown,Nicola ,unknown,2025/4/14 1:12,No size 8,0
porteaportefashion,Apparel & Footwear,unknown,BridieeˇŻ ,unknown,2025/4/14 1:12,Sorry did you say good for wide foot?,1
porteaportefashion,Apparel & Footwear,unknown,Caroline,unknown,2025/4/14 1:12,Thank you,0
porteaportefashion,Apparel & Footwear,unknown,LauraB,unknown,2025/4/14 1:12,Ordered black and beige,0
porteaportefashion,Apparel & Footwear,unknown,mandy171512,unknown,2025/4/14 1:12,Did u get my order?,0
porteaportefashion,Apparel & Footwear,unknown,Faiza,unknown,2025/4/14 1:12,Just ordered the black,0
porteaportefashion,Apparel & Footwear,unknown,Minnieme,unknown,2025/4/14 1:12,just cancelled,0
porteaportefashion,Apparel & Footwear,unknown,Karen M Messenger,unknown,2025/4/14 1:12,jus the denim ?,1
porteaportefashion,Apparel & Footwear,unknown,Kari,unknown,2025/4/14 1:12,I was panicking there for a moment,0
porteaportefashion,Apparel & Footwear,unknown,jacki,unknown,2025/4/14 1:12,can I see the colours,1
porteaportefashion,Apparel & Footwear,unknown,michelle,unknown,2025/4/14 1:13,so I ordered beige and denim both mine will be cancelled??,0
porteaportefashion,Apparel & Footwear,unknown,BridieeˇŻ ,unknown,2025/4/14 1:13,Did I miss that top?,1
porteaportefashion,Apparel & Footwear,unknown,Karen M Messenger,unknown,2025/4/14 1:13,is it only denim that is being cancelled,1
porteaportefashion,Apparel & Footwear,unknown,  ..,unknown,2025/4/14 1:13,are all orders being cancelled?,0
porteaportefashion,Apparel & Footwear,unknown,Faiza,unknown,2025/4/14 1:13,Jenny if we order black is that ok?????,1
porteaportefashion,Apparel & Footwear,unknown,BLACK BEAUTY,unknown,2025/4/14 1:13,have not received my slippers received email delay,0
porteaportefashion,Apparel & Footwear,unknown,  ..,unknown,2025/4/14 1:14,ok I got black,0
porteaportefashion,Apparel & Footwear,unknown,BridieeˇŻ ,unknown,2025/4/14 1:14,Ah gutted! I love the green in that top!,0
porteaportefashion,Apparel & Footwear,unknown,carolineread477,unknown,2025/4/14 1:14,I ordered lilac and black,0
porteaportefashion,Apparel & Footwear,unknown,Stacey Duncan,unknown,2025/4/14 1:14,Ive preordered the beige,0
porteaportefashion,Apparel & Footwear,unknown,Claire Davies,unknown,2025/4/14 1:14,Are they true to size and wide feet?,1
porteaportefashion,Apparel & Footwear,unknown,Kim,unknown,2025/4/14 1:14,Denim or Lilac orders will be cancelled,0
porteaportefashion,Apparel & Footwear,unknown,laceysmith ,unknown,2025/4/14 1:14,How much the top you have on please,1
porteaportefashion,Apparel & Footwear,unknown,Faiza,unknown,2025/4/14 1:14,I ordered black is that ok ????,1
porteaportefashion,Apparel & Footwear,unknown,Kari,unknown,2025/4/14 1:14,No black or beige,0
porteaportefashion,Apparel & Footwear,unknown,Crochet_Critter,unknown,2025/4/14 1:15,Jen Abdul has a new plus size supplier of denim.Plse cud u ask if there will be size 26 jeggings??,0
porteaportefashion,Apparel & Footwear,unknown,laceysmith ,unknown,2025/4/14 1:15,How much the top you have on,1
porteaportefashion,Apparel & Footwear,unknown,De,unknown,2025/4/14 1:15,Jen can you show the lilac plz,1
porteaportefashion,Apparel & Footwear,unknown,LottieHM,unknown,2025/4/14 1:15,do they fit wide fit,1
porteaportefashion,Apparel & Footwear,unknown,Claire Davies,unknown,2025/4/14 1:15,Are they true to size,1
porteaportefashion,Apparel & Footwear,unknown,laceysmith ,unknown,2025/4/14 1:15,How much the top u have on,1
porteaportefashion,Apparel & Footwear,unknown,Claire Davies,unknown,2025/4/14 1:15,Wide fitting?,1
porteaportefashion,Apparel & Footwear,unknown,BecMac ,unknown,2025/4/14 1:16,Mines not showed as cancelled,0
porteaportefashion,Apparel & Footwear,unknown,Shabana,unknown,2025/4/14 1:16,there gorgeous,0
porteaportefashion,Apparel & Footwear,unknown,carolineread477,unknown,2025/4/14 1:16,I ordered lilac and black so will both be cancelled?,0
porteaportefashion,Apparel & Footwear,unknown,Claire Davies,unknown,2025/4/14 1:16,Fab thank you,0
porteaportefashion,Apparel & Footwear,unknown,Essex girl,unknown,2025/4/14 1:16,Is the red a post box red,1
porteaportefashion,Apparel & Footwear,unknown,De,unknown,2025/4/14 1:16,Gawjus,0
porteaportefashion,Apparel & Footwear,unknown,laceysmith ,unknown,2025/4/14 1:16,How much your top you have on please,1
porteaportefashion,Apparel & Footwear,unknown,linda,unknown,2025/4/14 1:16,are they confortable gorgeous walking,1
porteaportefashion,Apparel & Footwear,unknown,Brionie,unknown,2025/4/14 1:16,are them sandals good for plantar fasciitis,1
porteaportefashion,Apparel & Footwear,unknown,Essex girl,unknown,2025/4/14 1:16,Thanks,0
porteaportefashion,Apparel & Footwear,unknown,Julie Symons,unknown,2025/4/14 1:16,so if you ordered yesterday would it be cancelled,0
porteaportefashion,Apparel & Footwear,unknown,Nicola ,unknown,2025/4/14 1:16,Can ask if they can add more size 8 please.,1
porteaportefashion,Apparel & Footwear,unknown,Shabana,unknown,2025/4/14 1:16,They are all gorgeous and hard to choose,0
porteaportefashion,Apparel & Footwear,unknown,carolineread477,unknown,2025/4/14 1:17,Wide fit,0
porteaportefashion,Apparel & Footwear,unknown,GemLou,unknown,2025/4/14 1:17,Are they really 35? Seems steep to me,1
porteaportefashion,Apparel & Footwear,unknown,Hanouna,unknown,2025/4/14 1:17,how much is the tops,1
porteaportefashion,Apparel & Footwear,unknown,linda,unknown,2025/4/14 1:17,are they confortable for walking,1
porteaportefashion,Apparel & Footwear,unknown,Brionie,unknown,2025/4/14 1:17,jen are them sandals good for plantar fasciitis,1
porteaportefashion,Apparel & Footwear,unknown,laceysmith ,unknown,2025/4/14 1:17,Can I see the top you have on please,1
porteaportefashion,Apparel & Footwear,unknown,Caroline Colliass,unknown,2025/4/14 1:17,thanks guys,0
porteaportefashion,Apparel & Footwear,unknown,laceysmith ,unknown,2025/4/14 1:17,How much top you have on please,0
porteaportefashion,Apparel & Footwear,unknown,PeachyPeaches ,unknown,2025/4/14 1:17,Phew. I ordered black and red on pre order the other day,0
porteaportefashion,Apparel & Footwear,unknown,Liv,unknown,2025/4/14 1:18,Need these for my holiday,0
porteaportefashion,Apparel & Footwear,unknown,Brionie,unknown,2025/4/14 1:18,Jen are the sandals got for plantar fasciitis,1
porteaportefashion,Apparel & Footwear,unknown,linda,unknown,2025/4/14 1:18,how confortable are they please,1
porteaportefashion,Apparel & Footwear,unknown,Anita Patel,unknown,2025/4/14 1:18,Ladies you can see they are sorting it out. Please stop asking about other things. Give them a min,0
porteaportefashion,Apparel & Footwear,unknown,staceydolltallulah1,unknown,2025/4/14 1:18,Even though preorder size 7 gone?,0
porteaportefashion,Apparel & Footwear,unknown,L_V,unknown,2025/4/14 1:19,Ok thanks girls,0
porteaportefashion,Apparel & Footwear,unknown,Kari,unknown,2025/4/14 1:19,"Jen I have planter fasciitis, and when I tried them on, they were so comfortable",0
porteaportefashion,Apparel & Footwear,unknown,Missy,unknown,2025/4/14 1:19,"LADIES PLEASE RESPECT ABDUL AND MODS, ABDUL HAS ASKED NO REQUESTS",0
porteaportefashion,Apparel & Footwear,unknown,LottieHM,unknown,2025/4/14 1:19,can we see how high fabric opening is please. Struggle with tops not being big enough,0
porteaportefashion,Apparel & Footwear,unknown,chris,unknown,2025/4/14 1:19,What do people not understand,0
porteaportefashion,Apparel & Footwear,unknown,carolineread477,unknown,2025/4/14 1:19,I ordered lilac and black and only the lilac was cancelled not the black,0
porteaportefashion,Apparel & Footwear,unknown,LottieHM,unknown,2025/4/14 1:20,can we see how high fabric opening is please. Struggle with tops not being big enough,1
porteaportefashion,Apparel & Footwear,unknown,michelle,unknown,2025/4/14 1:20,I have to order both again?? like denim and beige,1
porteaportefashion,Apparel & Footwear,unknown,paulasbookishcrafts,unknown,2025/4/14 1:20,Can u show colours,1
porteaportefashion,Apparel & Footwear,unknown,linda,unknown,2025/4/14 1:20,are they confortable for walking,1
porteaportefashion,Apparel & Footwear,unknown,Myka,unknown,2025/4/14 1:20,Helo!,0
porteaportefashion,Apparel & Footwear,unknown,Anita Patel,unknown,2025/4/14 1:20,Jen hug Abdul from me!,0
porteaportefashion,Apparel & Footwear,unknown,Hanouna,unknown,2025/4/14 1:20,how much,1
porteaportefashion,Apparel & Footwear,unknown,Mary,unknown,2025/4/14 1:20,We understand Abdul,0
porteaportefashion,Apparel & Footwear,unknown,Nicola ,unknown,2025/4/14 1:21,The lilac is a beautiful colour,0
porteaportefashion,Apparel & Footwear,unknown,paulasbookishcrafts,unknown,2025/4/14 1:21,Could u show colours,1
porteaportefashion,Apparel & Footwear,unknown,Kari,unknown,2025/4/14 1:21,Can we order size 8,1
porteaportefashion,Apparel & Footwear,unknown,Tina Jeffery,unknown,2025/4/14 1:21,can you pre order one of each colour,1
porteaportefashion,Apparel & Footwear,unknown,Zenaya,unknown,2025/4/14 1:21,Now the colour sold out,0
porteaportefashion,Apparel & Footwear,unknown,Myka,unknown,2025/4/14 1:22,Wow stunning!,0
porteaportefashion,Apparel & Footwear,unknown,LottieHM,unknown,2025/4/14 1:22,can we see how high fabric opening is please.,1
porteaportefashion,Apparel & Footwear,unknown,Claire Rowles,unknown,2025/4/14 1:22,are they true to size?,1
porteaportefashion,Apparel & Footwear,unknown,Zenaya,unknown,2025/4/14 1:22,The lilac now sold out,0
porteaportefashion,Apparel & Footwear,unknown,TEMPLEOFWAX,unknown,2025/4/14 1:22,I can get red this time!! I miss them every time!!,0
porteaportefashion,Apparel & Footwear,unknown,Chels,unknown,2025/4/14 1:22,is that beige?,1
porteaportefashion,Apparel & Footwear,unknown,De,unknown,2025/4/14 1:22,Lilac saying sold out,0
porteaportefashion,Apparel & Footwear,unknown,Zenaya,unknown,2025/4/14 1:22,Size 5 sold out lilac,0
porteaportefashion,Apparel & Footwear,unknown,francesyoung346,unknown,2025/4/14 1:22,Lilac in 5 is sold out,0
porteaportefashion,Apparel & Footwear,unknown,Kari,unknown,2025/4/14 1:23,Beige is gone dize8,0
porteaportefashion,Apparel & Footwear,unknown,paulasbookishcrafts,unknown,2025/4/14 1:23,Could u show the lilic,1
porteaportefashion,Apparel & Footwear,unknown,Livelovelaugh,unknown,2025/4/14 1:23,ABDUL LILAC 5 is there,1
porteaportefashion,Apparel & Footwear,unknown,Minnieme,unknown,2025/4/14 1:23,got Denim,0
porteaportefashion,Apparel & Footwear,unknown,Tanya,unknown,2025/4/14 1:23,HAS THE CARGOS ALREADY BEEN DONE,0
porteaportefashion,Apparel & Footwear,unknown,Londonlife Cypriot  ,unknown,2025/4/14 1:23,can I see the red  please,1
porteaportefashion,Apparel & Footwear,unknown,Nicola ,unknown,2025/4/14 1:24,Can you do more size 8 please,1
porteaportefashion,Apparel & Footwear,unknown,Sharon1_G,unknown,2025/4/14 1:24,I have- been charged 35,0
porteaportefashion,Apparel & Footwear,unknown,jemma,unknown,2025/4/14 1:24,I lost my lilac,0
porteaportefashion,Apparel & Footwear,unknown,missybooboooo.x,unknown,2025/4/14 1:24,Got the black thank you,0
porteaportefashion,Apparel & Footwear,unknown,Carol Taylor,unknown,2025/4/14 1:24,I got 2,0
porteaportefashion,Apparel & Footwear,unknown,De,unknown,2025/4/14 1:24,Got lilac now thanks,0
porteaportefashion,Apparel & Footwear,unknown,Claire Rowles,unknown,2025/4/14 1:24,got some in black,0
porteaportefashion,Apparel & Footwear,unknown,Claire Davies,unknown,2025/4/14 1:24,Ordered the black and beige thank you,0
porteaportefashion,Apparel & Footwear,unknown,sarahjane18,unknown,2025/4/14 1:24,Reinstone sandals,1
porteaportefashion,Apparel & Footwear,unknown,Kari,unknown,2025/4/14 1:24,Not size 8 Abdul,0
porteaportefashion,Apparel & Footwear,unknown,jacki,unknown,2025/4/14 1:25,got beige an lilac,0
porteaportefashion,Apparel & Footwear,unknown,Maarja,unknown,2025/4/14 1:25,I received my beige and black today,0
porteaportefashion,Apparel & Footwear,unknown,BecMac ,unknown,2025/4/14 1:25,Got black and denim,0
porteaportefashion,Apparel & Footwear,unknown, Jessica/ mum of four ,unknown,2025/4/14 1:25,I've missed it again,0
porteaportefashion,Apparel & Footwear,unknown,Maarja,unknown,2025/4/14 1:25,Woow more colours,0
porteaportefashion,Apparel & Footwear,unknown,Cj_LondonB9,unknown,2025/4/14 1:25,Love jens tattoo,0
porteaportefashion,Apparel & Footwear,unknown,Deborah68,unknown,2025/4/14 1:25,Got 4 pairs,0
porteaportefashion,Apparel & Footwear,unknown,francesyoung346,unknown,2025/4/14 1:25,They are lovely,0
porteaportefashion,Apparel & Footwear,unknown,Zenaya,unknown,2025/4/14 1:25,Got 3 pairs,0
porteaportefashion,Apparel & Footwear,unknown,PeachyPeaches ,unknown,2025/4/14 1:25,So glad I ordered these yesterday,0
porteaportefashion,Apparel & Footwear,unknown,Tina,unknown,2025/4/14 1:25,Yay I got the red,0
porteaportefashion,Apparel & Footwear,unknown,yaz,unknown,2025/4/14 1:25,I received mine today wish I ordered a size up,0
porteaportefashion,Apparel & Footwear,unknown,missybooboooo.x,unknown,2025/4/14 1:25,Got black,0
porteaportefashion,Apparel & Footwear,unknown,Livelovelaugh,unknown,2025/4/14 1:25,Jen is famous famous,0
porteaportefashion,Apparel & Footwear,unknown,kirsty1984,unknown,2025/4/14 1:25,gutted no 7s in the colours I wanted,0
porteaportefashion,Apparel & Footwear,unknown,lisakelly652,unknown,2025/4/14 1:26,ordered black yesterday.  love my camel ones.,0
porteaportefashion,Apparel & Footwear,unknown, Jessica/ mum of four ,unknown,2025/4/14 1:26,ive missed them again,0
porteaportefashion,Apparel & Footwear,unknown,Amanda Welsh,unknown,2025/4/14 1:26,ordered black size 5,0
porteaportefashion,Apparel & Footwear,unknown,KatieNaNa:/,unknown,2025/4/14 1:26,So we size up on the sandles jen ?,1
porteaportefashion,Apparel & Footwear,unknown,yaz,unknown,2025/4/14 1:26,im a size 7,0
porteaportefashion,Apparel & Footwear,unknown,Sophm145,unknown,2025/4/14 1:26,Thank you love you,0
porteaportefashion,Apparel & Footwear,unknown,Faiza,unknown,2025/4/14 1:26,Ordered a black,0
porteaportefashion,Apparel & Footwear,unknown, Jessica/ mum of four ,unknown,2025/4/14 1:26,u got another style sliders??,1
porteaportefashion,Apparel & Footwear,unknown,Mavis Halliday,unknown,2025/4/14 1:26,have u done the cargos please,0
porteaportefashion,Apparel & Footwear,unknown,Deborah68,unknown,2025/4/14 1:26,Got 4,0
porteaportefashion,Apparel & Footwear,unknown,Missy,unknown,2025/4/14 1:26,"LADIES PLEASE RESPECT ABDUL AND MODS, ABDUL HAS ASKED NO REQUESTS",0
porteaportefashion,Apparel & Footwear,unknown,lisakelly652,unknown,2025/4/14 1:26,have I missed swimwear today?,1
porteaportefashion,Apparel & Footwear,unknown,yaz,unknown,2025/4/14 1:26,7 a little small,0
porteaportefashion,Apparel & Footwear,unknown,June Mcdermid,unknown,2025/4/14 1:27,Any tops in a size 20,1
porteaportefashion,Apparel & Footwear,unknown,Livelovelaugh,unknown,2025/4/14 1:27,Never known so many size 8s before lol,0
porteaportefashion,Apparel & Footwear,unknown,TEMPLEOFWAX,unknown,2025/4/14 1:27,I know Jen,0
porteaportefashion,Apparel & Footwear,unknown,KatieNaNa:/,unknown,2025/4/14 1:28,Do we size up Jen,0
porteaportefashion,Apparel & Footwear,unknown,Ann,unknown,2025/4/14 1:28,Nice cup tea u want,0
porteaportefashion,Apparel & Footwear,unknown,Missy,unknown,2025/4/14 1:28,"LADIES PLEASE RESPECT ABDUL AND MODS, ABDUL HAS ASKED NO REQUESTS",0
porteaportefashion,Apparel & Footwear,unknown,Jess Sarin,unknown,2025/4/14 1:29,I got the denim ones size six they fit perfect,0
porteaportefashion,Apparel & Footwear,unknown,TEMPLEOFWAX,unknown,2025/4/14 1:29,I had time get a different colour to what I really wanted but nevertheless I got some,0
porteaportefashion,Apparel & Footwear,unknown,Livelovelaugh,unknown,2025/4/14 1:29,No blinking for the foreseeable,0
porteaportefashion,Apparel & Footwear,unknown,mandy,unknown,2025/4/14 1:29,yes,0
porteaportefashion,Apparel & Footwear,unknown,TEMPLEOFWAX,unknown,2025/4/14 1:29,I had to get a different colour to what I really wanted but nevertheless I got some,0
porteaportefashion,Apparel & Footwear,unknown,Tina Jeffery,unknown,2025/4/14 1:29,hell yeah so excited,0
porteaportefashion,Apparel & Footwear,unknown,Georgina Askew,unknown,2025/4/14 1:29,Ooooo show us!,0
porteaportefashion,Apparel & Footwear,unknown,stellasawyer8,unknown,2025/4/14 1:30,Can you move the camera down so I can see the colours please?,1
porteaportefashion,Apparel & Footwear,unknown,Pam,unknown,2025/4/14 1:30,Got one,0
porteaportefashion,Apparel & Footwear,unknown,alisonroach123,unknown,2025/4/14 1:30,yess,0
porteaportefashion,Apparel & Footwear,unknown,Linda g,unknown,2025/4/14 1:30,yesx,0
porteaportefashion,Apparel & Footwear,unknown,Georgina Askew,unknown,2025/4/14 1:30,Yes!!!,0
porteaportefashion,Apparel & Footwear,unknown,Caroline Colville,unknown,2025/4/14 1:30,Not going blink lol,0
porteaportefashion,Apparel & Footwear,unknown,Victoria Jordan27,unknown,2025/4/14 1:30,What does it cost to subscribe please,1
porteaportefashion,Apparel & Footwear,unknown,Debs,unknown,2025/4/14 1:30,no blinking ..,0
porteaportefashion,Apparel & Footwear,unknown,eaglelady2,unknown,2025/4/14 1:30,Abdul what are you doing,0
porteaportefashion,Apparel & Footwear,unknown,Venesha ,unknown,2025/4/14 1:30,Ooooh!!!,0
porteaportefashion,Apparel & Footwear,unknown,Shelley,unknown,2025/4/14 1:30,Lips,0
porteaportefashion,Apparel & Footwear,unknown,Pam,unknown,2025/4/14 1:30,lol,0
porteaportefashion,Apparel & Footwear,unknown,lucybwfcsnape,unknown,2025/4/14 1:30,Omg,0
porteaportefashion,Apparel & Footwear,unknown,Samantha B-Llewellyn ,unknown,2025/4/14 1:30,Omg omg,0
porteaportefashion,Apparel & Footwear,unknown,BecMac ,unknown,2025/4/14 1:30,Wow,0
porteaportefashion,Apparel & Footwear,unknown,TEMPLEOFWAX,unknown,2025/4/14 1:30,Abdul opening up the door for requests,0
porteaportefashion,Apparel & Footwear,unknown, claire ,unknown,2025/4/14 1:30,omg I need,0
porteaportefashion,Apparel & Footwear,unknown,Dawn Nunn883,unknown,2025/4/14 1:30,Nice dresses,1
porteaportefashion,Apparel & Footwear,unknown,Marley,unknown,2025/4/14 1:31,cherries,0
porteaportefashion,Apparel & Footwear,unknown,KatieNaNa:/,unknown,2025/4/14 1:31,Oh lalaaaaaaaaaa,0
porteaportefashion,Apparel & Footwear,unknown,Aldene,unknown,2025/4/14 1:31,run,0
porteaportefashion,Apparel & Footwear,unknown,Chan-Rose,unknown,2025/4/14 1:31,looks amazing,0
porteaportefashion,Apparel & Footwear,unknown,michelle,unknown,2025/4/14 1:31,tease,0
porteaportefashion,Apparel & Footwear,unknown,mandy,unknown,2025/4/14 1:31,omgoodness excited,0
porteaportefashion,Apparel & Footwear,unknown,AgataP25,unknown,2025/4/14 1:31,amazing,0
porteaportefashion,Apparel & Footwear,unknown,Pam,unknown,2025/4/14 1:31,Hopeless,0
porteaportefashion,Apparel & Footwear,unknown,Cj_LondonB9,unknown,2025/4/14 1:31,Is that onsie lol,0
porteaportefashion,Apparel & Footwear,unknown,Livelovelaugh,unknown,2025/4/14 1:31,THAT WAS THE SLOWEST and fastest walk ever,0
porteaportefashion,Apparel & Footwear,unknown,berni,unknown,2025/4/14 1:31,missed it,0
porteaportefashion,Apparel & Footwear,unknown,stephcrook0,unknown,2025/4/14 1:31,stunning,0
porteaportefashion,Apparel & Footwear,unknown,SiobhanPage1990,unknown,2025/4/14 1:31,aww wow did I see some kisses lol,0
porteaportefashion,Apparel & Footwear,unknown,Georgina Askew,unknown,2025/4/14 1:31,Omgggggggggggg,0
porteaportefashion,Apparel & Footwear,unknown,Elle,unknown,2025/4/14 1:31,Abdul is such a tease,0
porteaportefashion,Apparel & Footwear,unknown,GangstaGranny1963,unknown,2025/4/14 1:31,Abdul your a big tease,0
porteaportefashion,Apparel & Footwear,unknown,CDuarteStitchlover1,unknown,2025/4/14 1:31,Do again Abdul,0
porteaportefashion,Apparel & Footwear,unknown,..LouLou..,unknown,2025/4/14 1:31,show again,0
porteaportefashion,Apparel & Footwear,unknown,Gill,unknown,2025/4/14 1:31,teasing us,0
porteaportefashion,Apparel & Footwear,unknown,Sarah,unknown,2025/4/14 1:31,cherries,1
porteaportefashion,Apparel & Footwear,unknown,eaglelady2,unknown,2025/4/14 1:31,awful Jenny I was told not to say anything to anyone,0
