live_id,species,user_id,user_name,gender,time,content,label
porteaportefashion,Apparel & Footwear,unknown,Crawly,unknown,2025/4/14 3:29,Hope chan will be ok,0
porteaportefashion,Apparel & Footwear,unknown,Laura,unknown,2025/4/14 3:29,Egypt again lol,0
porteaportefashion,Apparel & Footwear,unknown,Chels,unknown,2025/4/14 3:29,they've gone up lol,0
porteaportefashion,Apparel & Footwear,unknown,SiobhanPage1990,unknown,2025/4/14 3:29,all good,0
porteaportefashion,Apparel & Footwear,unknown,Tashelle,unknown,2025/4/14 3:29,Can you leave them in the basket,0
porteaportefashion,Apparel & Footwear,unknown,Laura,unknown,2025/4/14 3:29,None of our business,0
porteaportefashion,Apparel & Footwear,unknown,  ..,unknown,2025/4/14 3:29,im gonna miss her  glad shes getting a break though,0
porteaportefashion,Apparel & Footwear,unknown,Patricia64,unknown,2025/4/14 3:29,have you got any scuba jeggings,0
porteaportefashion,Apparel & Footwear,unknown,Victoria Jordan27,unknown,2025/4/14 3:30,When is the next live next week,0
porteaportefashion,Apparel & Footwear,unknown, Joy ,unknown,2025/4/14 3:30,please show the trousers,1
porteaportefashion,Apparel & Footwear,unknown,Mia786,unknown,2025/4/14 3:30,will fit a 18.  very stretchy,0
porteaportefashion,Apparel & Footwear,unknown, Joy ,unknown,2025/4/14 3:30,please show trousers,1
porteaportefashion,Apparel & Footwear,unknown,Patricia64,unknown,2025/4/14 3:30,any scuba jeggings,0
porteaportefashion,Apparel & Footwear,unknown,Victoria Jordan27,unknown,2025/4/14 3:30,Will Jen be on with you,0
porteaportefashion,Apparel & Footwear,unknown,mycatmini1,unknown,2025/4/14 3:31,Love that colour,0
porteaportefashion,Apparel & Footwear,unknown,Angela Crosby,unknown,2025/4/14 3:31,Plus size playsuit,0
porteaportefashion,Apparel & Footwear,unknown,Ally Galbraith ,unknown,2025/4/14 3:31,"NO REQUESTS PLEASE LADIES, JUST ENJOY THE BEAUTIFUL ITEMS ABDUL HAS FOR US",0
porteaportefashion,Apparel & Footwear,unknown,Mia786,unknown,2025/4/14 3:31,love these leggings,1
porteaportefashion,Apparel & Footwear,unknown,Patricia64,unknown,2025/4/14 3:31,thanks I got some last time and they lovely,0
porteaportefashion,Apparel & Footwear,unknown,Cj_LondonB9,unknown,2025/4/14 3:31,That colour suits ya Jen,0
porteaportefashion,Apparel & Footwear,unknown, Joy ,unknown,2025/4/14 3:31,can you show trousers to camera please,1
porteaportefashion,Apparel & Footwear,unknown,Janette Sheppard733,unknown,2025/4/14 3:31,Are they cotton,1
porteaportefashion,Apparel & Footwear,unknown,Jade W ,unknown,2025/4/14 3:31,Do you have any more of the sports bra and short leggings sets?,1
porteaportefashion,Apparel & Footwear,unknown,Victoria Jordan27,unknown,2025/4/14 3:31,You look very trim Jen,0
porteaportefashion,Apparel & Footwear,unknown,kc,unknown,2025/4/14 3:32,are they see through,1
porteaportefashion,Apparel & Footwear,unknown,LONDON QUEEN 2024,unknown,2025/4/14 3:32,cannit size a 26,1
porteaportefashion,Apparel & Footwear,unknown,Mia786,unknown,2025/4/14 3:32,got loads last time,0
porteaportefashion,Apparel & Footwear,unknown,Anita Patel,unknown,2025/4/14 3:32,Ladies can you remember these 2 have been on since this morning! Please stop requesting,0
porteaportefashion,Apparel & Footwear,unknown,tina120757,unknown,2025/4/14 3:32,Got my pleated pants today only just come so not looked yet,0
porteaportefashion,Apparel & Footwear,unknown,simplybeingkaz,unknown,2025/4/14 3:32,I got my leggings today! Blooming amazing!!!! Love them.,0
porteaportefashion,Apparel & Footwear,unknown,Susansmith,unknown,2025/4/14 3:32,Yes,0
porteaportefashion,Apparel & Footwear,unknown,LONDON QUEEN 2024,unknown,2025/4/14 3:32,is size 26 available,0
porteaportefashion,Apparel & Footwear,unknown,susanbamgbose,unknown,2025/4/14 3:32,it says 2.50,0
porteaportefashion,Apparel & Footwear,unknown,Just Jane,unknown,2025/4/14 3:32,They where like that yesterday too,0
porteaportefashion,Apparel & Footwear,unknown,xcrazyx,unknown,2025/4/14 3:32,No black,0
porteaportefashion,Apparel & Footwear,unknown,Sophie Elaine313,unknown,2025/4/14 3:33,behaving my self till Thursday,0
porteaportefashion,Apparel & Footwear,unknown,DannieH13,unknown,2025/4/14 3:33,What size please,1
porteaportefashion,Apparel & Footwear,unknown,Angela Crosby,unknown,2025/4/14 3:33,Plus size playsuit,1
porteaportefashion,Apparel & Footwear,unknown,Charl Stubbs ,unknown,2025/4/14 3:34,how much are the sandles?,1
porteaportefashion,Apparel & Footwear,unknown,Janette Sheppard733,unknown,2025/4/14 3:34,Will you be doing blazers,1
porteaportefashion,Apparel & Footwear,unknown,Ally Galbraith ,unknown,2025/4/14 3:34,"LADIES, PLEASE REMEMBER. NO REQUESTS MEANS NO REQUESTS, HOWEVER ITS WORDED",0
porteaportefashion,Apparel & Footwear,unknown,Anita Patel,unknown,2025/4/14 3:34,Ladies remember these 2 have been on since this morning! Please stop requesting as mods have said,0
porteaportefashion,Apparel & Footwear,unknown,sue jmillard,unknown,2025/4/14 3:34,perfume  tshirt.   p513,0
porteaportefashion,Apparel & Footwear,unknown,Crochet_Critter,unknown,2025/4/14 3:34,is late night lydia working tonight.  wud she like a pair,1
porteaportefashion,Apparel & Footwear,unknown,Pam,unknown,2025/4/14 3:34,Jen those leggings suit u,0
porteaportefashion,Apparel & Footwear,unknown,clare,unknown,2025/4/14 3:34,heart trainers was preorder yest as i bought them,0
porteaportefashion,Apparel & Footwear,unknown,helenearle33,unknown,2025/4/14 3:35,size please,1
porteaportefashion,Apparel & Footwear,unknown,DonnaMarie80,unknown,2025/4/14 3:35,yes u did,0
porteaportefashion,Apparel & Footwear,unknown,Andie j (2),unknown,2025/4/14 3:35,Yes they were done 1st thing yesterday,0
porteaportefashion,Apparel & Footwear,unknown,eaglelady2,unknown,2025/4/14 3:35,yes,0
porteaportefashion,Apparel & Footwear,unknown,Jade W ,unknown,2025/4/14 3:35,Yeah deffo,0
porteaportefashion,Apparel & Footwear,unknown,_ ,unknown,2025/4/14 3:35,yeah you did,0
porteaportefashion,Apparel & Footwear,unknown,clare,unknown,2025/4/14 3:35,i bought them yest,0
porteaportefashion,Apparel & Footwear,unknown,Nikki,unknown,2025/4/14 3:35,ease up with requests they getting through as much as they can,0
porteaportefashion,Apparel & Footwear,unknown,Crochet_Critter,unknown,2025/4/14 3:35,is lydia there wud she like some leggings.  what colour,1
porteaportefashion,Apparel & Footwear,unknown,val mum of 6 nan of 3,unknown,2025/4/14 3:35,u did definitely do them,0
porteaportefashion,Apparel & Footwear,unknown,Victoria ,unknown,2025/4/14 3:35,yes eagle said,0
porteaportefashion,Apparel & Footwear,unknown,Jade W ,unknown,2025/4/14 3:36,You did them twice yesterday,0
porteaportefashion,Apparel & Footwear,unknown,DonnaMarie80,unknown,2025/4/14 3:36,u did them again in the afternoon on pre order,0
porteaportefashion,Apparel & Footwear,unknown,michelle,unknown,2025/4/14 3:36,we done them with chan,0
porteaportefashion,Apparel & Footwear,unknown,Andie j (2),unknown,2025/4/14 3:36,I think they were preorder,0
porteaportefashion,Apparel & Footwear,unknown,Janette Sheppard733,unknown,2025/4/14 3:36,Thank you,0
porteaportefashion,Apparel & Footwear,unknown,S H O R T S,unknown,2025/4/14 3:36,They were pre order,0
porteaportefashion,Apparel & Footwear,unknown,Angela P,unknown,2025/4/14 3:36,Yes,0
porteaportefashion,Apparel & Footwear,unknown,Deborah68,unknown,2025/4/14 3:36,Yes yes,0
porteaportefashion,Apparel & Footwear,unknown,Breeze18_,unknown,2025/4/14 3:36,Would leggings fit 18,1
porteaportefashion,Apparel & Footwear,unknown,Sophie Elaine313,unknown,2025/4/14 3:36,hahahaa,0
porteaportefashion,Apparel & Footwear,unknown,Kerry-Jo,unknown,2025/4/14 3:36,Have I missed the shoes,1
porteaportefashion,Apparel & Footwear,unknown,Just Jane,unknown,2025/4/14 3:36,They were pre order last night with Chan.,0
porteaportefashion,Apparel & Footwear,unknown,Sophie Elaine313,unknown,2025/4/14 3:36,i love mine so comfy,0
porteaportefashion,Apparel & Footwear,unknown,Rara,unknown,2025/4/14 3:36,Are the leggings fleece lined?,1
porteaportefashion,Apparel & Footwear,unknown,nanniejannie11,unknown,2025/4/14 3:37,Have you got black in a six,1
porteaportefashion,Apparel & Footwear,unknown,Sophie Elaine313,unknown,2025/4/14 3:37,ye I love the smell to,0
porteaportefashion,Apparel & Footwear,unknown,missmuffett,unknown,2025/4/14 3:37,My granddaughter loves them trainers i bought her,0
porteaportefashion,Apparel & Footwear,unknown,Kerry-Jo,unknown,2025/4/14 3:37,Have I missed these trainers,1
porteaportefashion,Apparel & Footwear,unknown,Sophie Elaine313,unknown,2025/4/14 3:37,yeh I keep smelling mine hahhaa,0
porteaportefashion,Apparel & Footwear,unknown,debbieshaw1960,unknown,2025/4/14 3:37,How much trainers Jen please,1
porteaportefashion,Apparel & Footwear,unknown,Shelley Sellings TMT,unknown,2025/4/14 3:37,How much are the trainers,1
porteaportefashion,Apparel & Footwear,unknown,clare,unknown,2025/4/14 3:38,its says on my order 4 trainers preorder,0
porteaportefashion,Apparel & Footwear,unknown,Janette Sheppard733,unknown,2025/4/14 3:38,Just ordered royal blue and bottle green leggings,0
porteaportefashion,Apparel & Footwear,unknown,Rachel,unknown,2025/4/14 3:39,They are stunning,0
porteaportefashion,Apparel & Footwear,unknown,Tracy*E*Grant2611,unknown,2025/4/14 3:39,I got these the other day they are fab,0
porteaportefashion,Apparel & Footwear,unknown,Emilysizer,unknown,2025/4/14 3:40,Ohh love them,0
porteaportefashion,Apparel & Footwear,unknown,ayeshatutul786,unknown,2025/4/14 3:41,Would u be getting anymore sliders in camel,1
porteaportefashion,Apparel & Footwear,unknown,rosiemay200,unknown,2025/4/14 3:41,Size,1
porteaportefashion,Apparel & Footwear,unknown,LH72,unknown,2025/4/14 3:41,Evening lovely Abdul hope you are well,0
porteaportefashion,Apparel & Footwear,unknown,rosiemay200,unknown,2025/4/14 3:41,Size leggings,1
porteaportefashion,Apparel & Footwear,unknown,Martina,unknown,2025/4/14 3:41,Abdul your trainers are absolutely the best I have 2 in different colours,0
porteaportefashion,Apparel & Footwear,unknown,Just Jules,unknown,2025/4/14 3:41,amazing heart trainer very comfortable,0
porteaportefashion,Apparel & Footwear,unknown,stephenholliday75,unknown,2025/4/14 3:41,thank u,0
porteaportefashion,Apparel & Footwear,unknown,Mully,unknown,2025/4/14 3:42,Size 5 black,0
porteaportefashion,Apparel & Footwear,unknown,JUE71,unknown,2025/4/14 3:42,I ordered trainers last Saturday and received them on the Monday.,0
porteaportefashion,Apparel & Footwear,unknown,Charlotte Horwood,unknown,2025/4/14 3:42,got the white,0
porteaportefashion,Apparel & Footwear,unknown,Katrina Andrews606,unknown,2025/4/14 3:42,"Wow those trainers are a bargain, look identical to my sketchers which cost 100.00",0
porteaportefashion,Apparel & Footwear,unknown,Kelly,unknown,2025/4/14 3:42,Have you got bigger in the leggings,1
porteaportefashion,Apparel & Footwear,unknown,Martina,unknown,2025/4/14 3:43,Abdul you do the best trainers i have 2 pairs there fantastic,0
porteaportefashion,Apparel & Footwear,unknown,clarealger4,unknown,2025/4/14 3:43,Hi Jen!!,0
porteaportefashion,Apparel & Footwear,unknown,Pam,unknown,2025/4/14 3:43,Got black so now have black and white now,0
porteaportefashion,Apparel & Footwear,unknown,Blissful,unknown,2025/4/14 3:43,They are gorgeous!!!,1
porteaportefashion,Apparel & Footwear,unknown,Liyah Patel,unknown,2025/4/14 3:44,Will u get black in the seamless leggings?,1
porteaportefashion,Apparel & Footwear,unknown,Steph.P,unknown,2025/4/14 3:44,"Any slinky dresses today babe? ( not a request, just a question)",1
porteaportefashion,Apparel & Footwear,unknown,Lisa Winn,unknown,2025/4/14 3:44,Ordered black thank you,0
porteaportefashion,Apparel & Footwear,unknown,DonnaMarie80,unknown,2025/4/14 3:44,tshirts,1
porteaportefashion,Apparel & Footwear,unknown,debbieshaw1960,unknown,2025/4/14 3:44,Flower jackets please,1
porteaportefashion,Apparel & Footwear,unknown,clarealger4,unknown,2025/4/14 3:44,Nice colour leggings,1
porteaportefashion,Apparel & Footwear,unknown,Samantha B-Llewellyn ,unknown,2025/4/14 3:44,Swimwear,1
porteaportefashion,Apparel & Footwear,unknown,Martina,unknown,2025/4/14 3:44,I have theses in black and white there fa,0
porteaportefashion,Apparel & Footwear,unknown,Kathmc ,unknown,2025/4/14 3:45,Yes i have wide foot and still room and true to size im 6,0
porteaportefashion,Apparel & Footwear,unknown,Lesley Jones,unknown,2025/4/14 3:45,Brilliant for wide feet,0
porteaportefashion,Apparel & Footwear,unknown,debbieshaw1960,unknown,2025/4/14 3:45,Flower jacket please,1
porteaportefashion,Apparel & Footwear,unknown,Pam,unknown,2025/4/14 3:45,So comfy wide enough and love them,0
porteaportefashion,Apparel & Footwear,unknown,Mully,unknown,2025/4/14 3:45,I just got the trainers and 3 leggings thanks guys  have a good Sunday,0
porteaportefashion,Apparel & Footwear,unknown,ayeshatutul786,unknown,2025/4/14 3:45,Will u be getting anymore slides in camel colour,1
porteaportefashion,Apparel & Footwear,unknown,tracey104,unknown,2025/4/14 3:45,Any jeggings?,1
porteaportefashion,Apparel & Footwear,unknown,marie(ted),unknown,2025/4/14 3:45,I love the white,1
porteaportefashion,Apparel & Footwear,unknown,kelly hutchins,unknown,2025/4/14 3:45,order both colours tyx,0
porteaportefashion,Apparel & Footwear,unknown,Charl Stubbs ,unknown,2025/4/14 3:45,do u have cargos?,1
porteaportefashion,Apparel & Footwear,unknown,sharonavis3,unknown,2025/4/14 3:46,true to size?,1
porteaportefashion,Apparel & Footwear,unknown,Martina,unknown,2025/4/14 3:46,fantastic live today Jenny,0
porteaportefashion,Apparel & Footwear,unknown,paulasbookishcrafts,unknown,2025/4/14 3:46,What sizes does leggings fit please,1
porteaportefashion,Apparel & Footwear,unknown,clarealger4,unknown,2025/4/14 3:46,Voice is going!!,0
porteaportefashion,Apparel & Footwear,unknown,paulasbookishcrafts,unknown,2025/4/14 3:47,Thank you,0
porteaportefashion,Apparel & Footwear,unknown,Kelly,unknown,2025/4/14 3:47,You getting anymore of the black leggings that was 3,1
porteaportefashion,Apparel & Footwear,unknown,Nicola Dass,unknown,2025/4/14 3:47,Need help yes,0
porteaportefashion,Apparel & Footwear,unknown,Hanouna,unknown,2025/4/14 3:47,hi abdul how are you,0
porteaportefashion,Apparel & Footwear,unknown,Hanouna,unknown,2025/4/14 3:48,not forgot about you Jen how are you,0
porteaportefashion,Apparel & Footwear,unknown,sharonavis3,unknown,2025/4/14 3:48,just bought black trainers,0
porteaportefashion,Apparel & Footwear,unknown,Nicola Dass,unknown,2025/4/14 3:48,How to do preorder,0
porteaportefashion,Apparel & Footwear,unknown,Nicola Dass,unknown,2025/4/14 3:48,I want white and black,1
porteaportefashion,Apparel & Footwear,unknown,Sandra,unknown,2025/4/14 3:48,I have all 3 of them blazers. They are beautiful,1
porteaportefashion,Apparel & Footwear,unknown,Hanouna,unknown,2025/4/14 3:49,how are you jenny and,0
porteaportefashion,Apparel & Footwear,unknown,Rochelle-y-87,unknown,2025/4/14 3:49,Evening Abdul and Jen,0
porteaportefashion,Apparel & Footwear,unknown,ayeshatutul786,unknown,2025/4/14 3:49,Will be getting anymore slides in camel size 6,1
porteaportefashion,Apparel & Footwear,unknown,Rochelle-y-87,unknown,2025/4/14 3:50,Swit swoo Jen,0
porteaportefashion,Apparel & Footwear,unknown,Sam ginns,unknown,2025/4/14 3:50,Do u have anymore arabellas left please? My hubby tumble dryed mine,0
porteaportefashion,Apparel & Footwear,unknown,Sam Grundy,unknown,2025/4/14 3:50,Love that colour,1
porteaportefashion,Apparel & Footwear,unknown,Nicola Dass,unknown,2025/4/14 3:50,Trainers,1
porteaportefashion,Apparel & Footwear,unknown,Nicola Dass,unknown,2025/4/14 3:51,Do I and them to my order,0
porteaportefashion,Apparel & Footwear,unknown,Rajinder kaur,unknown,2025/4/14 3:51,please show the black shoes,1
porteaportefashion,Apparel & Footwear,unknown,Dawn,unknown,2025/4/14 3:51,What size is that largest please,1
porteaportefashion,Apparel & Footwear,unknown,kc,unknown,2025/4/14 3:51,Jen what size you wearing,1
porteaportefashion,Apparel & Footwear,unknown,debbieshaw1960,unknown,2025/4/14 3:51,Can you put bigger one on Jen,1
porteaportefashion,Apparel & Footwear,unknown,ayeshatutul786,unknown,2025/4/14 3:51,Will u be getting anymore camel slides in size 6,1
porteaportefashion,Apparel & Footwear,unknown,Angela Crosby,unknown,2025/4/14 3:51,What size is 22 in blazer,1
porteaportefashion,Apparel & Footwear,unknown,Laura,unknown,2025/4/14 3:52,sizes again please,1
porteaportefashion,Apparel & Footwear,unknown,Hanouna,unknown,2025/4/14 3:52,how are you abdul jot forgot about  lovely  Jen how are you,0
porteaportefashion,Apparel & Footwear,unknown,Nicola Dass,unknown,2025/4/14 3:52,Not working for me,0
porteaportefashion,Apparel & Footwear,unknown,natashax,unknown,2025/4/14 3:52,Never returned anything love it all. my girls nicking my trainers,0
porteaportefashion,Apparel & Footwear,unknown,DebraAnne,unknown,2025/4/14 3:52,Do these have pockets,1
porteaportefashion,Apparel & Footwear,unknown,Hanouna,unknown,2025/4/14 3:52,good,0
porteaportefashion,Apparel & Footwear,unknown,Angie's jaro journey ,unknown,2025/4/14 3:52,Can we see the black on please?,1
porteaportefashion,Apparel & Footwear,unknown,Kirsty38Essex,unknown,2025/4/14 3:52,Can you try black on please Jenny,0
porteaportefashion,Apparel & Footwear,unknown,debbieshaw1960,unknown,2025/4/14 3:53,Can you put black on,1
porteaportefashion,Apparel & Footwear,unknown,Lisa wilkinson,unknown,2025/4/14 3:53,are u still doing lace trousers on pre order plz abdul,1
porteaportefashion,Apparel & Footwear,unknown,Madi ratcliffe,unknown,2025/4/14 3:53,Could jenny try the bigger size for sizing please,1
porteaportefashion,Apparel & Footwear,unknown,Shannon ,unknown,2025/4/14 3:53,any paper bag trousers to go with these?,1
porteaportefashion,Apparel & Footwear,unknown,John5683,unknown,2025/4/14 3:54,Do u sell bojina shirt,1
porteaportefashion,Apparel & Footwear,unknown,The Griffs,unknown,2025/4/14 3:54,This is really my most favourite blazer from you,0
porteaportefashion,Apparel & Footwear,unknown,Angela Crosby,unknown,2025/4/14 3:54,Please can I see plus size playsuit,1
porteaportefashion,Apparel & Footwear,unknown,LeannaLT36,unknown,2025/4/14 3:54,wedding guest vibes,0
porteaportefashion,Apparel & Footwear,unknown,farrah,unknown,2025/4/14 3:54,they was being rude,0
porteaportefashion,Apparel & Footwear,unknown,sehrishbutt93,unknown,2025/4/14 3:54,Stone is literally gone,0
porteaportefashion,Apparel & Footwear,unknown,eaglelady2,unknown,2025/4/14 3:54,ignore Abdul,0
porteaportefashion,Apparel & Footwear,unknown,chris,unknown,2025/4/14 3:54,Rude Abdul,0
porteaportefashion,Apparel & Footwear,unknown,tina120757,unknown,2025/4/14 3:54,Wanted the stone,1
porteaportefashion,Apparel & Footwear,unknown,Katrina Andrews606,unknown,2025/4/14 3:54,What size is the stone plz,1
porteaportefashion,Apparel & Footwear,unknown,Nicola Dass,unknown,2025/4/14 3:54,Done it now thanks,0
porteaportefashion,Apparel & Footwear,unknown,farrah,unknown,2025/4/14 3:55,block chris,0
porteaportefashion,Apparel & Footwear,unknown,tina120757,unknown,2025/4/14 3:55,That looks better on you,0
porteaportefashion,Apparel & Footwear,unknown,Nicola Dass,unknown,2025/4/14 3:55,Yes,0
porteaportefashion,Apparel & Footwear,unknown,eaglelady2,unknown,2025/4/14 3:56,WELCOME TO THE LIVE LADIES PLEASE ENJOY   NO REQUESTS TODAY PLEASE,0
porteaportefashion,Apparel & Footwear,unknown,TalkToTammy,unknown,2025/4/14 3:56,that blue would go lovely with denim blue jeans,1
porteaportefashion,Apparel & Footwear,unknown,Raven Dark Shadow,unknown,2025/4/14 3:56,will you get graffiti  blazers,1
porteaportefashion,Apparel & Footwear,unknown,sehrishbutt93,unknown,2025/4/14 3:57,Good for work,0
porteaportefashion,Apparel & Footwear,unknown,Sam ginns,unknown,2025/4/14 3:57,Do u have any arabella left plz? My hubby tumble dryed mine,1
porteaportefashion,Apparel & Footwear,unknown,Jo allatson ,unknown,2025/4/14 3:57,that bue one,0
porteaportefashion,Apparel & Footwear,unknown,tracey104,unknown,2025/4/14 3:57,Any jeggings?,1
porteaportefashion,Apparel & Footwear,unknown,Sam ginns,unknown,2025/4/14 3:57,Ta hun,0
porteaportefashion,Apparel & Footwear,unknown,Ally Galbraith ,unknown,2025/4/14 3:57,"LADIES, ENOUGH OF THE REQUESTS NOW. WE HAVE ASKED ALL DAY, PLEASE",0
porteaportefashion,Apparel & Footwear,unknown,Amanda,unknown,2025/4/14 3:57,I love these blazers! Everyone asks where I got them from when I wear them!,0
porteaportefashion,Apparel & Footwear,unknown,Jo allatson ,unknown,2025/4/14 3:58,definitely,0
porteaportefashion,Apparel & Footwear,unknown,eaglelady2,unknown,2025/4/14 3:58,WELCOME TO THE LIVE LADIES PLEASE ENJOY   NO REQUESTS TODAY PLEASE,0
porteaportefashion,Apparel & Footwear,unknown,Ann,unknown,2025/4/14 3:58,why are they showing up 40pd,0
porteaportefashion,Apparel & Footwear,unknown,Kim Blackwell,unknown,2025/4/14 3:59,Can you show the trainers please,1
porteaportefashion,Apparel & Footwear,unknown,Oceanlover - Carolynn,unknown,2025/4/14 3:59,Ahhh sugar I missed them,0
porteaportefashion,Apparel & Footwear,unknown,Missy,unknown,2025/4/14 3:59,"LADIES PLEASE HAVE RESPECT FOR THE MODS AND ABDUL, ABDUL HAS SAID NO REQUESTS",0
porteaportefashion,Apparel & Footwear,unknown,debbieshaw1960,unknown,2025/4/14 3:59,Can u put them back on please,0
porteaportefashion,Apparel & Footwear,unknown,mickiet21,unknown,2025/4/14 3:59,how much are the blazers?,1
porteaportefashion,Apparel & Footwear,unknown,Rebecca Beech,unknown,2025/4/14 3:59,Ask Abdul if he can add the black on in 6xl,1
porteaportefashion,Apparel & Footwear,unknown,Cj_LondonB9,unknown,2025/4/14 4:00,Omg these look lush,1
porteaportefashion,Apparel & Footwear,unknown,Raven Dark Shadow,unknown,2025/4/14 4:00,will you be getting  the graffiti blazers,1
porteaportefashion,Apparel & Footwear,unknown,Livelovelaugh,unknown,2025/4/14 4:00,"Just want to say, sending you both a massive hug, and high five for today",0
porteaportefashion,Apparel & Footwear,unknown,natashax,unknown,2025/4/14 4:00,Just done about 8  five star reviews,0
porteaportefashion,Apparel & Footwear,unknown,Oceanlover - Carolynn,unknown,2025/4/14 4:01,Whoooo hoooo I got one,0
porteaportefashion,Apparel & Footwear,unknown,sehrishbutt93,unknown,2025/4/14 4:02,Me :),0
porteaportefashion,Apparel & Footwear,unknown,HonestlyReviewed,unknown,2025/4/14 4:03,I have a 3 day week,0
porteaportefashion,Apparel & Footwear,unknown,Ann,unknown,2025/4/14 4:03,U on till 12,0
porteaportefashion,Apparel & Footwear,unknown,DebSenior,unknown,2025/4/14 4:03,yaay for 2x 4 day weeks!!!,0
porteaportefashion,Apparel & Footwear,unknown,HonestlyReviewed,unknown,2025/4/14 4:03,3 day week And a 6 day weekend for me,0
porteaportefashion,Apparel & Footwear,unknown,Suzanne,unknown,2025/4/14 4:03,Am still working on the bank holidays,0
porteaportefashion,Apparel & Footwear,unknown,DebraAnne,unknown,2025/4/14 4:03,Not hear my name called,0
porteaportefashion,Apparel & Footwear,unknown,Ann,unknown,2025/4/14 4:04,I've ordered 2 one black and 1 white,0
porteaportefashion,Apparel & Footwear,unknown,DebraAnne,unknown,2025/4/14 4:04,Debra Anne,0
porteaportefashion,Apparel & Footwear,unknown,Ann,unknown,2025/4/14 4:04,I've ordered 2 jackets never heard my name,0
porteaportefashion,Apparel & Footwear,unknown,JulieC71,unknown,2025/4/14 4:06,Can everyone tap,0
porteaportefashion,Apparel & Footwear,unknown,Joanne_Mulberry,unknown,2025/4/14 4:06,iv got 2 in tie dye they stunning on and soooooo comfy,0
porteaportefashion,Apparel & Footwear,unknown,Kimmy,unknown,2025/4/14 4:07,30 definitely,0
porteaportefashion,Apparel & Footwear,unknown,beavs,unknown,2025/4/14 4:07,size please jumpsuit,1
porteaportefashion,Apparel & Footwear,unknown,francesyoung346,unknown,2025/4/14 4:07,I e got these they are soft and comfy. Heaven,0
porteaportefashion,Apparel & Footwear,unknown,aligriff00,unknown,2025/4/14 4:08,Sorry missed the size,0
porteaportefashion,Apparel & Footwear,unknown,The Griffs,unknown,2025/4/14 4:08,Looks amazing on you Jen,0
porteaportefashion,Apparel & Footwear,unknown,Joanne_Mulberry,unknown,2025/4/14 4:08,are there any tie dye ones left?,1
porteaportefashion,Apparel & Footwear,unknown,Deborah,unknown,2025/4/14 4:08,How much are they,1
porteaportefashion,Apparel & Footwear,unknown,chantelle9525,unknown,2025/4/14 4:08,Imagine pairing that cherry with the black and pink blazer,0
porteaportefashion,Apparel & Footwear,unknown,kazzabrice1,unknown,2025/4/14 4:08,Jen how many holes on the buckles please,1
porteaportefashion,Apparel & Footwear,unknown,Deborah,unknown,2025/4/14 4:09,Have they gone in basket yet,0
porteaportefashion,Apparel & Footwear,unknown,kazzabrice1,unknown,2025/4/14 4:09,Thank you Jen,0
porteaportefashion,Apparel & Footwear,unknown,Julie Symons,unknown,2025/4/14 4:09,do they have pockets,1
porteaportefashion,Apparel & Footwear,unknown,bingofan7diane xxx,unknown,2025/4/14 4:09,we having a giveaway on this abdul,0
porteaportefashion,Apparel & Footwear,unknown,lotsoflove11_11,unknown,2025/4/14 4:09,I bought the trainers but as went through it changed to 40,0
porteaportefashion,Apparel & Footwear,unknown,Vicky D,unknown,2025/4/14 4:09,how do i order black plz,1
porteaportefashion,Apparel & Footwear,unknown,Victoria,unknown,2025/4/14 4:10,Can you add Tle 170,0
porteaportefashion,Apparel & Footwear,unknown,Kimmy,unknown,2025/4/14 4:10,I love my tye dye jumpsuit so comfy I never wore jumpsuit before until I brought here :),0
porteaportefashion,Apparel & Footwear,unknown,AgataP25,unknown,2025/4/14 4:10,#porteaporte #bargains #sunday,0
porteaportefashion,Apparel & Footwear,unknown,Kelly-Anne ,unknown,2025/4/14 4:12,#porteaporte #bargains #sunday,0
porteaportefashion,Apparel & Footwear,unknown,debbieshaw1960,unknown,2025/4/14 4:13,#porteaporte #bargains #sunday,0
porteaportefashion,Apparel & Footwear,unknown,val mum of 6 nan of 3,unknown,2025/4/14 4:14,#porteaporte #bargains #sunday,0
porteaportefashion,Apparel & Footwear,unknown,jadelee12234,unknown,2025/4/14 4:17,how much are they jen,0
